date,location,attendance,inning,inning_top_bot,score,batting,fielding,description,game_pbp_url,game_pbp_id
02/23/2022,"Macon, GA",NA,1,top,0-0,Florida A&M,Mercer,Z. Burnham grounded out to 2b.,https://stats.ncaa.org/game/play_by_play/5214702,5214702
02/23/2022,"Macon, GA",NA,1,top,0-0,Florida A&M,Mercer,J. Pierini doubled to right field.,https://stats.ncaa.org/game/play_by_play/5214702,5214702
02/23/2022,"Macon, GA",NA,1,top,0-0,Florida A&M,Mercer,L. Bryant popped up to 1b.,https://stats.ncaa.org/game/play_by_play/5214702,5214702
02/23/2022,"Macon, GA",NA,1,top,0-0,Florida A&M,Mercer,T. Hanchey popped up to ss.,https://stats.ncaa.org/game/play_by_play/5214702,5214702
02/23/2022,"Macon, GA",NA,1,top,0-0,Florida A&M,Mercer,H: 1 LOB: 1,https://stats.ncaa.org/game/play_by_play/5214702,5214702
02/23/2022,"Macon, GA",NA,1,bot,0-0,Mercer,Florida A&M,Colby Thomas flied out to rf.,https://stats.ncaa.org/game/play_by_play/5214702,5214702
02/23/2022,"Macon, GA",NA,1,bot,0-0,Mercer,Florida A&M,T. Austin singled to second base.,https://stats.ncaa.org/game/play_by_play/5214702,5214702
02/23/2022,"Macon, GA",NA,1,bot,0-0,Mercer,Florida A&M,Bill Knight singled to left field3a T. Austin advanced to second.,https://stats.ncaa.org/game/play_by_play/5214702,5214702
02/23/2022,"Macon, GA",NA,1,bot,0-0,Mercer,Florida A&M,Collin Price reached on a fielder's choice3a Bill Knight advanced to second3a T. Austin out at third 3b unassisted.,https://stats.ncaa.org/game/play_by_play/5214702,5214702
02/23/2022,"Macon, GA",NA,1,bot,0-0,Mercer,Florida A&M,A. DiSpigna flied out to lf.,https://stats.ncaa.org/game/play_by_play/5214702,5214702
02/23/2022,"Macon, GA",NA,1,top,0-0,Florida A&M,Mercer,H: 2 LOB: 2,https://stats.ncaa.org/game/play_by_play/5214702,5214702
02/23/2022,"Macon, GA",NA,2,top,0-0,Florida A&M,Mercer,G. Rowell singled.,https://stats.ncaa.org/game/play_by_play/5214702,5214702
02/23/2022,"Macon, GA",NA,2,top,0-0,Florida A&M,Mercer,Haidermota singled to third base3a G. Rowell advanced to second.,https://stats.ncaa.org/game/play_by_play/5214702,5214702
02/23/2022,"Macon, GA",NA,2,top,0-0,Florida A&M,Mercer,E. Jenkins struck out looking.,https://stats.ncaa.org/game/play_by_play/5214702,5214702
02/23/2022,"Macon, GA",NA,2,top,0-0,Florida A&M,Mercer,T. Dunbar struck out looking.,https://stats.ncaa.org/game/play_by_play/5214702,5214702
02/23/2022,"Macon, GA",NA,2,top,0-0,Florida A&M,Mercer,J. Niles flied out to rf.,https://stats.ncaa.org/game/play_by_play/5214702,5214702
02/23/2022,"Macon, GA",NA,2,top,0-9,Florida A&M,Mercer,H: 2 LOB: 2,https://stats.ncaa.org/game/play_by_play/5214702,5214702
02/23/2022,"Macon, GA",NA,2,bot,0-0,Mercer,Florida A&M,David Burke grounded out to 3b.,https://stats.ncaa.org/game/play_by_play/5214702,5214702
02/23/2022,"Macon, GA",NA,2,bot,0-0,Mercer,Florida A&M,J Rohrbacher reached on an error by c.,https://stats.ncaa.org/game/play_by_play/5214702,5214702
02/23/2022,"Macon, GA",NA,2,bot,0-0,Mercer,Florida A&M,W. Mapes singled to left center3a J Rohrbacher advanced to second.,https://stats.ncaa.org/game/play_by_play/5214702,5214702
02/23/2022,"Macon, GA",NA,2,bot,0-0,Mercer,Florida A&M,T. Hughes singled to right center3a W. Mapes advanced to second3a J Rohrbacher advanced to third.,https://stats.ncaa.org/game/play_by_play/5214702,5214702
02/23/2022,"Macon, GA",NA,2,bot,0-1,Mercer,Florida A&M,"Colby Thomas singled to left field, RBI3a T. Hughes advanced to second3a W. Mapes advanced to third3a J Rohrbacher scored.",https://stats.ncaa.org/game/play_by_play/5214702,5214702
02/23/2022,"Macon, GA",NA,2,bot,0-2,Mercer,Florida A&M,"T. Austin flied out to cf, SF, RBI3a W. Mapes scored.",https://stats.ncaa.org/game/play_by_play/5214702,5214702
02/23/2022,"Macon, GA",NA,2,bot,0-4,Mercer,Florida A&M,"Bill Knight doubled to left field, 2 RBI3a Colby Thomas scored3a T. Hughes scored.",https://stats.ncaa.org/game/play_by_play/5214702,5214702
02/23/2022,"Macon, GA",NA,2,bot,0-4,Mercer,Florida A&M,Collin Price walked.,https://stats.ncaa.org/game/play_by_play/5214702,5214702
02/23/2022,"Macon, GA",NA,2,bot,0-6,Mercer,Florida A&M,"A. DiSpigna doubled to right field, 2 RBI3a Collin Price scored3a Bill Knight scored.",https://stats.ncaa.org/game/play_by_play/5214702,5214702
02/23/2022,"Macon, GA",NA,2,bot,0-7,Mercer,Florida A&M,"David Burke singled to center field, RBI3a A. DiSpigna scored.",https://stats.ncaa.org/game/play_by_play/5214702,5214702
02/23/2022,"Macon, GA",NA,2,bot,0-9,Mercer,Florida A&M,"J Rohrbacher homered to right field, 2 RBI3a David Burke scored.",https://stats.ncaa.org/game/play_by_play/5214702,5214702
02/23/2022,"Macon, GA",NA,2,bot,0-9,Mercer,Florida A&M,W. Mapes singled to left field.,https://stats.ncaa.org/game/play_by_play/5214702,5214702
02/23/2022,"Macon, GA",NA,2,bot,0-9,Mercer,Florida A&M,T. Hughes walked3a W. Mapes advanced to second.,https://stats.ncaa.org/game/play_by_play/5214702,5214702
02/23/2022,"Macon, GA",NA,2,bot,0-9,Mercer,Florida A&M,Colby Thomas flied out to lf.,https://stats.ncaa.org/game/play_by_play/5214702,5214702
02/23/2022,"Macon, GA",NA,2,top,0-9,Florida A&M,Mercer,R: 9 H: 8 E: 1 LOB: 2,https://stats.ncaa.org/game/play_by_play/5214702,5214702
02/23/2022,"Macon, GA",NA,3,top,0-9,Florida A&M,Mercer,Z. Burnham struck out swinging.,https://stats.ncaa.org/game/play_by_play/5214702,5214702
02/23/2022,"Macon, GA",NA,3,top,0-9,Florida A&M,Mercer,J. Pierini struck out swinging.,https://stats.ncaa.org/game/play_by_play/5214702,5214702
02/23/2022,"Macon, GA",NA,3,top,0-9,Florida A&M,Mercer,L. Bryant singled to shortstop.,https://stats.ncaa.org/game/play_by_play/5214702,5214702
02/23/2022,"Macon, GA",NA,3,top,0-9,Florida A&M,Mercer,T. Hanchey singled to center field3a L. Bryant advanced to third.,https://stats.ncaa.org/game/play_by_play/5214702,5214702
02/23/2022,"Macon, GA",NA,3,top,0-9,Florida A&M,Mercer,G. Rowell struck out swinging.,https://stats.ncaa.org/game/play_by_play/5214702,5214702
02/23/2022,"Macon, GA",NA,3,top,0-10,Florida A&M,Mercer,H: 2 LOB: 2,https://stats.ncaa.org/game/play_by_play/5214702,5214702
02/23/2022,"Macon, GA",NA,3,bot,0-9,Mercer,Florida A&M,T. Austin flied out to cf.,https://stats.ncaa.org/game/play_by_play/5214702,5214702
02/23/2022,"Macon, GA",NA,3,bot,0-10,Mercer,Florida A&M,"Bill Knight homered to left field, RBI.",https://stats.ncaa.org/game/play_by_play/5214702,5214702
02/23/2022,"Macon, GA",NA,3,bot,0-10,Mercer,Florida A&M,Collin Price flied out to rf.,https://stats.ncaa.org/game/play_by_play/5214702,5214702
02/23/2022,"Macon, GA",NA,3,bot,0-10,Mercer,Florida A&M,A. DiSpigna flied out to cf.,https://stats.ncaa.org/game/play_by_play/5214702,5214702
02/23/2022,"Macon, GA",NA,3,top,0-10,Florida A&M,Mercer,R: 1 H: 1,https://stats.ncaa.org/game/play_by_play/5214702,5214702
02/23/2022,"Macon, GA",NA,4,top,0-10,Florida A&M,Mercer,Beau Healy to p for Ryan Lobus.,https://stats.ncaa.org/game/play_by_play/5214702,5214702
02/23/2022,"Macon, GA",NA,4,top,0-10,Florida A&M,Mercer,Haidermota grounded out to 2b.,https://stats.ncaa.org/game/play_by_play/5214702,5214702
02/23/2022,"Macon, GA",NA,4,top,0-10,Florida A&M,Mercer,E. Jenkins struck out swinging.,https://stats.ncaa.org/game/play_by_play/5214702,5214702
02/23/2022,"Macon, GA",NA,4,top,0-10,Florida A&M,Mercer,T. Dunbar struck out swinging.,https://stats.ncaa.org/game/play_by_play/5214702,5214702
02/23/2022,"Macon, GA",NA,4,bot,0-10,Mercer,Florida A&M,Z. Morea to p for S. Host.,https://stats.ncaa.org/game/play_by_play/5214702,5214702
02/23/2022,"Macon, GA",NA,4,bot,0-10,Mercer,Florida A&M,David Burke lined out to 3b.,https://stats.ncaa.org/game/play_by_play/5214702,5214702
02/23/2022,"Macon, GA",NA,4,bot,0-10,Mercer,Florida A&M,J Rohrbacher grounded out to 1b unassisted.,https://stats.ncaa.org/game/play_by_play/5214702,5214702
02/23/2022,"Macon, GA",NA,4,bot,0-10,Mercer,Florida A&M,W. Mapes struck out swinging.,https://stats.ncaa.org/game/play_by_play/5214702,5214702
02/23/2022,"Macon, GA",NA,5,top,0-10,Florida A&M,Mercer,C. Cosper to p for Beau Healy.,https://stats.ncaa.org/game/play_by_play/5214702,5214702
02/23/2022,"Macon, GA",NA,5,top,0-10,Florida A&M,Mercer,J. Niles grounded out to ss.,https://stats.ncaa.org/game/play_by_play/5214702,5214702
02/23/2022,"Macon, GA",NA,5,top,0-10,Florida A&M,Mercer,Z. Burnham grounded out to 3b.,https://stats.ncaa.org/game/play_by_play/5214702,5214702
02/23/2022,"Macon, GA",NA,5,top,0-10,Florida A&M,Mercer,J. Pierini struck out looking.,https://stats.ncaa.org/game/play_by_play/5214702,5214702
02/23/2022,"Macon, GA",NA,5,bot,0-11,Mercer,Florida A&M,"T. Hughes homered to right field, RBI.",https://stats.ncaa.org/game/play_by_play/5214702,5214702
02/23/2022,"Macon, GA",NA,5,bot,0-12,Mercer,Florida A&M,"Colby Thomas homered to left field, RBI.",https://stats.ncaa.org/game/play_by_play/5214702,5214702
02/23/2022,"Macon, GA",NA,5,bot,0-12,Mercer,Florida A&M,T. Austin grounded out to 3b.,https://stats.ncaa.org/game/play_by_play/5214702,5214702
02/23/2022,"Macon, GA",NA,5,bot,0-12,Mercer,Florida A&M,T. Turner to p for Z. Morea.,https://stats.ncaa.org/game/play_by_play/5214702,5214702
02/23/2022,"Macon, GA",NA,5,bot,0-12,Mercer,Florida A&M,Bill Knight singled to shortstop.,https://stats.ncaa.org/game/play_by_play/5214702,5214702
02/23/2022,"Macon, GA",NA,5,bot,0-12,Mercer,Florida A&M,Collin Price grounded into double play 2b to ss to 1b3a Bill Knight out on the play.,https://stats.ncaa.org/game/play_by_play/5214702,5214702
02/23/2022,"Macon, GA",NA,5,bot,0-12,Mercer,Florida A&M,R: 2 H: 3,https://stats.ncaa.org/game/play_by_play/5214702,5214702
02/23/2022,"Macon, GA",NA,6,top,0-12,Florida A&M,Mercer,L. Bryant reached on an error by 3b.,https://stats.ncaa.org/game/play_by_play/5214702,5214702
02/23/2022,"Macon, GA",NA,6,top,0-12,Florida A&M,Mercer,L. Bryant advanced to second.,https://stats.ncaa.org/game/play_by_play/5214702,5214702
02/23/2022,"Macon, GA",NA,6,top,0-12,Florida A&M,Mercer,T. Hanchey hit by pitch.,https://stats.ncaa.org/game/play_by_play/5214702,5214702
02/23/2022,"Macon, GA",NA,6,top,0-12,Florida A&M,Mercer,L. Bryant advanced to third.,https://stats.ncaa.org/game/play_by_play/5214702,5214702
02/23/2022,"Macon, GA",NA,6,top,0-12,Florida A&M,Mercer,G. Rowell grounded into double play ss to 2b to 1b3a T. Hanchey out on the play.,https://stats.ncaa.org/game/play_by_play/5214702,5214702
02/23/2022,"Macon, GA",NA,6,top,0-12,Florida A&M,Mercer,Haidermota struck out swinging.,https://stats.ncaa.org/game/play_by_play/5214702,5214702
02/23/2022,"Macon, GA",NA,6,top,0-15,Florida A&M,Mercer,E: 1 LOB: 1,https://stats.ncaa.org/game/play_by_play/5214702,5214702
02/23/2022,"Macon, GA",NA,6,bot,0-12,Mercer,Florida A&M,Trevor Rider to rf for Colby Thomas.,https://stats.ncaa.org/game/play_by_play/5214702,5214702
02/23/2022,"Macon, GA",NA,6,bot,0-12,Mercer,Florida A&M,A. Brown to 2b for T. Austin.,https://stats.ncaa.org/game/play_by_play/5214702,5214702
02/23/2022,"Macon, GA",NA,6,bot,0-12,Mercer,Florida A&M,C. Ellard to lf for Bill Knight.,https://stats.ncaa.org/game/play_by_play/5214702,5214702
02/23/2022,"Macon, GA",NA,6,bot,0-12,Mercer,Florida A&M,T. Hughes to cf.,https://stats.ncaa.org/game/play_by_play/5214702,5214702
02/23/2022,"Macon, GA",NA,6,bot,0-12,Mercer,Florida A&M,A. DiSpigna doubled to left field.,https://stats.ncaa.org/game/play_by_play/5214702,5214702
02/23/2022,"Macon, GA",NA,6,bot,0-12,Mercer,Florida A&M,D. Ramil pinch ran for A. DiSpigna.,https://stats.ncaa.org/game/play_by_play/5214702,5214702
02/23/2022,"Macon, GA",NA,6,bot,0-12,Mercer,Florida A&M,R. Archibald pinch hit for David Burke.,https://stats.ncaa.org/game/play_by_play/5214702,5214702
02/23/2022,"Macon, GA",NA,6,bot,0-12,Mercer,Florida A&M,R. Archibald walked.,https://stats.ncaa.org/game/play_by_play/5214702,5214702
02/23/2022,"Macon, GA",NA,6,bot,0-12,Mercer,Florida A&M,J Rohrbacher flied out to lf.,https://stats.ncaa.org/game/play_by_play/5214702,5214702
02/23/2022,"Macon, GA",NA,6,bot,0-12,Mercer,Florida A&M,D. Ramil advanced to third on a wild pitch.,https://stats.ncaa.org/game/play_by_play/5214702,5214702
02/23/2022,"Macon, GA",NA,6,bot,0-12,Mercer,Florida A&M,R. Archibald advanced to second on a wild pitch.,https://stats.ncaa.org/game/play_by_play/5214702,5214702
02/23/2022,"Macon, GA",NA,6,bot,0-12,Mercer,Florida A&M,J. McCollum to p for T. Turner.,https://stats.ncaa.org/game/play_by_play/5214702,5214702
02/23/2022,"Macon, GA",NA,6,bot,0-12,Mercer,Florida A&M,W. Mapes walked.,https://stats.ncaa.org/game/play_by_play/5214702,5214702
02/23/2022,"Macon, GA",NA,6,bot,0-13,Mercer,Florida A&M,"T. Hughes hit by pitch, RBI3a W. Mapes advanced to second3a R. Archibald advanced to third3a D. Ramil scored.",https://stats.ncaa.org/game/play_by_play/5214702,5214702
02/23/2022,"Macon, GA",NA,6,bot,0-14,Mercer,Florida A&M,"Trevor Rider flied out to lf, SF, RBI3a R. Archibald scored.",https://stats.ncaa.org/game/play_by_play/5214702,5214702
02/23/2022,"Macon, GA",NA,6,bot,0-15,Mercer,Florida A&M,"A. Brown doubled, RBI3a T. Hughes advanced to third3a W. Mapes scored.",https://stats.ncaa.org/game/play_by_play/5214702,5214702
02/23/2022,"Macon, GA",NA,6,bot,0-15,Mercer,Florida A&M,.,https://stats.ncaa.org/game/play_by_play/5214702,5214702
02/23/2022,"Macon, GA",NA,6,bot,0-15,Mercer,Florida A&M,C. Ellard struck out swinging.,https://stats.ncaa.org/game/play_by_play/5214702,5214702
02/23/2022,"Macon, GA",NA,6,top,0-15,Florida A&M,Mercer,R: 3 H: 2 LOB: 2,https://stats.ncaa.org/game/play_by_play/5214702,5214702
02/23/2022,"Macon, GA",NA,7,top,0-15,Florida A&M,Mercer,D. Ramil to 3b.,https://stats.ncaa.org/game/play_by_play/5214702,5214702
02/23/2022,"Macon, GA",NA,7,top,0-15,Florida A&M,Mercer,R. Archibald to 1b.,https://stats.ncaa.org/game/play_by_play/5214702,5214702
02/23/2022,"Macon, GA",NA,7,top,0-15,Florida A&M,Mercer,Luke Sutko to p for C. Cosper.,https://stats.ncaa.org/game/play_by_play/5214702,5214702
02/23/2022,"Macon, GA",NA,7,top,0-15,Florida A&M,Mercer,E. Jenkins grounded out to ss.,https://stats.ncaa.org/game/play_by_play/5214702,5214702
02/23/2022,"Macon, GA",NA,7,top,0-15,Florida A&M,Mercer,B. Poppell to c for T. Dunbar.,https://stats.ncaa.org/game/play_by_play/5214702,5214702
02/23/2022,"Macon, GA",NA,7,top,0-15,Florida A&M,Mercer,B. Poppell struck out swinging.,https://stats.ncaa.org/game/play_by_play/5214702,5214702
02/23/2022,"Macon, GA",NA,7,top,0-15,Florida A&M,Mercer,R. Robinson to ss for J. Niles.,https://stats.ncaa.org/game/play_by_play/5214702,5214702
02/23/2022,"Macon, GA",NA,7,top,0-15,Florida A&M,Mercer,R. Robinson doubled to right field.,https://stats.ncaa.org/game/play_by_play/5214702,5214702
02/23/2022,"Macon, GA",NA,7,top,0-15,Florida A&M,Mercer,Z. Burnham grounded out to ss.,https://stats.ncaa.org/game/play_by_play/5214702,5214702
02/23/2022,"Macon, GA",NA,7,top,0-15,Florida A&M,Mercer,H: 1 LOB: 1,https://stats.ncaa.org/game/play_by_play/5214702,5214702
02/23/2022,"Macon, GA",NA,7,bot,0-15,Mercer,Florida A&M,C. Hart to 1b for G. Rowell.,https://stats.ncaa.org/game/play_by_play/5214702,5214702
02/23/2022,"Macon, GA",NA,7,bot,0-15,Mercer,Florida A&M,J. Cherry to dh for Collin Price.,https://stats.ncaa.org/game/play_by_play/5214702,5214702
02/23/2022,"Macon, GA",NA,7,bot,0-15,Mercer,Florida A&M,J. Cherry struck out swinging.,https://stats.ncaa.org/game/play_by_play/5214702,5214702
02/23/2022,"Macon, GA",NA,7,bot,0-15,Mercer,Florida A&M,D. Ramil singled to right field.,https://stats.ncaa.org/game/play_by_play/5214702,5214702
02/23/2022,"Macon, GA",NA,7,bot,0-15,Mercer,Florida A&M,R. Archibald struck out swinging.,https://stats.ncaa.org/game/play_by_play/5214702,5214702
02/23/2022,"Macon, GA",NA,7,bot,0-15,Mercer,Florida A&M,B. Schmitt to c for J Rohrbacher.,https://stats.ncaa.org/game/play_by_play/5214702,5214702
02/23/2022,"Macon, GA",NA,7,bot,0-15,Mercer,Florida A&M,B. Krizen to p for J. McCollum.,https://stats.ncaa.org/game/play_by_play/5214702,5214702
02/23/2022,"Macon, GA",NA,7,bot,0-15,Mercer,Florida A&M,B. Schmitt grounded out to 2b3a D. Ramil advanced to second.,https://stats.ncaa.org/game/play_by_play/5214702,5214702
02/23/2022,"Macon, GA",NA,7,top,0-15,Florida A&M,Mercer,H: 1 LOB: 1,https://stats.ncaa.org/game/play_by_play/5214702,5214702
02/23/2022,"Macon, GA",NA,8,top,0-15,Florida A&M,Mercer,H. McGaha to p for Luke Sutko.,https://stats.ncaa.org/game/play_by_play/5214702,5214702
02/23/2022,"Macon, GA",NA,8,top,0-15,Florida A&M,Mercer,J. Pierini singled to third base.,https://stats.ncaa.org/game/play_by_play/5214702,5214702
02/23/2022,"Macon, GA",NA,8,top,0-15,Florida A&M,Mercer,L. Bryant walked3a J. Pierini advanced to second.,https://stats.ncaa.org/game/play_by_play/5214702,5214702
02/23/2022,"Macon, GA",NA,8,top,0-15,Florida A&M,Mercer,T. Hanchey struck out swinging.,https://stats.ncaa.org/game/play_by_play/5214702,5214702
02/23/2022,"Macon, GA",NA,8,top,0-15,Florida A&M,Mercer,C. Hart struck out swinging.,https://stats.ncaa.org/game/play_by_play/5214702,5214702
02/23/2022,"Macon, GA",NA,8,top,0-15,Florida A&M,Mercer,W. Brown to 3b for Haidermota.,https://stats.ncaa.org/game/play_by_play/5214702,5214702
02/23/2022,"Macon, GA",NA,8,top,2-15,Florida A&M,Mercer,"W. Brown reached on an error by 3b, 2 RBI3a L. Bryant scored, unearned3a J. Pierini scored, unearned.",https://stats.ncaa.org/game/play_by_play/5214702,5214702
02/23/2022,"Macon, GA",NA,8,top,2-15,Florida A&M,Mercer,W. Brown advanced to second.,https://stats.ncaa.org/game/play_by_play/5214702,5214702
02/23/2022,"Macon, GA",NA,8,top,2-15,Florida A&M,Mercer,E. Jenkins popped up to ss.,https://stats.ncaa.org/game/play_by_play/5214702,5214702
02/23/2022,"Macon, GA",NA,8,bot,2-15,Mercer,Florida A&M,W. Mapes struck out swinging.,https://stats.ncaa.org/game/play_by_play/5214702,5214702
02/23/2022,"Macon, GA",NA,8,bot,2-15,Mercer,Florida A&M,T. Hughes singled to pitcher.,https://stats.ncaa.org/game/play_by_play/5214702,5214702
02/23/2022,"Macon, GA",NA,8,bot,2-15,Mercer,Florida A&M,Trevor Rider struck out swinging.,https://stats.ncaa.org/game/play_by_play/5214702,5214702
02/23/2022,"Macon, GA",NA,8,bot,2-15,Mercer,Florida A&M,A. Brown walked3a T. Hughes advanced to second.,https://stats.ncaa.org/game/play_by_play/5214702,5214702
02/23/2022,"Macon, GA",NA,8,bot,2-15,Mercer,Florida A&M,C. Ellard struck out swinging.,https://stats.ncaa.org/game/play_by_play/5214702,5214702
02/23/2022,"Macon, GA",NA,9,top,2-15,Florida A&M,Mercer,G. Sloan to p for H. McGaha.,https://stats.ncaa.org/game/play_by_play/5214702,5214702
02/23/2022,"Macon, GA",NA,9,top,2-15,Florida A&M,Mercer,B. Poppell struck out swinging.,https://stats.ncaa.org/game/play_by_play/5214702,5214702
02/23/2022,"Macon, GA",NA,9,top,2-15,Florida A&M,Mercer,R. Robinson grounded out to 2b.,https://stats.ncaa.org/game/play_by_play/5214702,5214702
02/23/2022,"Macon, GA",NA,9,top,2-15,Florida A&M,Mercer,E. Badger to cf for Z. Burnham.,https://stats.ncaa.org/game/play_by_play/5214702,5214702
02/23/2022,"Macon, GA",NA,9,top,2-15,Florida A&M,Mercer,E. Badger popped up to 2b.,https://stats.ncaa.org/game/play_by_play/5214702,5214702
